{
  "manifest_version": 1,
  "release": "18.1",
  "reviewed_on": "2026-10-31",
  "reviewed_by": "adilnurgg",
  "policy": "Nothing third-party is bundled: packages are installed from PyPI, components are separately installed or called services. Licence summaries are not legal advice. Statuses: WORKING = ran on its real backend outside unit tests, with a committed run artifact; TESTED = wired and exercised by CI tests with offline stand-ins, never against the live thing; NOT_CONFIGURED = not wired, not installed, or no credentials/hardware. Verified by scripts/check_dependencies.py; see docs/engineering/DEPENDENCIES_AND_ADAPTERS.md.",
  "python_packages": [
    {
      "name": "fastapi",
      "requirement": ">=0.115,<1",
      "pinned": "0.162.0",
      "license": "MIT",
      "license_metadata": "MIT",
      "upstream": "https://github.com/fastapi/fastapi",
      "used_by": "qualityrelay17/api.py"
    },
    {
      "name": "uvicorn",
      "requirement": ">=0.30,<1",
      "pinned": "0.54.0",
      "license": "BSD-3-Clause",
      "license_metadata": "BSD-3-Clause",
      "upstream": "https://github.com/encode/uvicorn",
      "used_by": "API server"
    },
    {
      "name": "pytest",
      "requirement": ">=8,<10",
      "pinned": "9.2.0",
      "license": "MIT",
      "license_metadata": "MIT",
      "upstream": "https://github.com/pytest-dev/pytest",
      "used_by": "tests/"
    },
    {
      "name": "pydantic",
      "requirement": ">=2,<3",
      "pinned": "2.14.2",
      "license": "MIT",
      "license_metadata": "MIT",
      "upstream": "https://github.com/pydantic/pydantic",
      "used_by": "API request models"
    },
    {
      "name": "numpy",
      "requirement": ">=2,<3",
      "pinned": "2.4.6",
      "license": "BSD-3-Clause AND 0BSD AND MIT AND Zlib AND CC0-1.0",
      "license_metadata": "BSD-3-Clause AND 0BSD AND MIT AND Zlib AND CC0-1.0",
      "upstream": "https://github.com/numpy/numpy",
      "used_by": "simulation, vision, Warp MC"
    },
    {
      "name": "scipy",
      "requirement": ">=1,<2",
      "pinned": "1.17.1",
      "license": "BSD-3-Clause",
      "license_metadata": "BSD",
      "upstream": "https://github.com/scipy/scipy",
      "used_by": "statistics, sim/optimization.py"
    },
    {
      "name": "opencv-python-headless",
      "requirement": ">=4.10,<5",
      "pinned": "4.14.0.94",
      "license": "Apache-2.0",
      "license_metadata": "Apache 2.0",
      "upstream": "https://github.com/opencv/opencv-python",
      "used_by": "vision.py, vision_measure.py, inspection_visuals.py"
    },
    {
      "name": "trimesh",
      "requirement": ">=4,<6",
      "pinned": "5.2.0",
      "license": "MIT",
      "license_metadata": "MIT",
      "upstream": "https://github.com/mikedh/trimesh",
      "used_by": "sim/cad.py, digital_twin.py"
    },
    {
      "name": "networkx",
      "requirement": ">=3,<4",
      "pinned": "3.6.1",
      "license": "BSD-3-Clause",
      "license_metadata": "BSD-3-Clause",
      "upstream": "https://github.com/networkx/networkx",
      "used_by": "trimesh mesh.section() in sim/cad.py (undeclared trimesh dependency, found by REL-03 clean-lock install)"
    },
    {
      "name": "openai",
      "requirement": ">=1,<3",
      "pinned": "2.54.0",
      "license": "Apache-2.0",
      "license_metadata": "Apache-2.0",
      "upstream": "https://github.com/openai/openai-python",
      "used_by": "collective/llm_planner.py, llm_entitlement.py, nebius.py (OpenAI-compatible client, also for Nebius)"
    },
    {
      "name": "ruff",
      "requirement": "==0.17.3",
      "pinned": "0.17.3",
      "license": "MIT",
      "license_metadata": "MIT",
      "upstream": "https://github.com/astral-sh/ruff",
      "used_by": "CI lint"
    },
    {
      "name": "mypy",
      "requirement": "==2.4.1",
      "pinned": "2.4.1",
      "license": "MIT",
      "license_metadata": "MIT",
      "upstream": "https://github.com/python/mypy",
      "used_by": "CI types"
    },
    {
      "name": "bandit",
      "requirement": "==1.9.4",
      "pinned": "1.9.4",
      "license": "Apache-2.0",
      "license_metadata": "Apache-2.0",
      "upstream": "https://github.com/PyCQA/bandit",
      "used_by": "CI security"
    },
    {
      "name": "pip-audit",
      "requirement": "==2.10.1",
      "pinned": "2.10.1",
      "license": "Apache-2.0",
      "license_metadata": "Apache-2.0",
      "upstream": "https://github.com/pypa/pip-audit",
      "used_by": "CI security"
    },
    {
      "name": "jsonschema",
      "requirement": "==4.26.0",
      "pinned": "4.26.0",
      "license": "MIT",
      "license_metadata": "MIT",
      "upstream": "https://github.com/python-jsonschema/jsonschema",
      "used_by": "CI schemas, this manifest's schema"
    },
    {
      "name": "packaging",
      "requirement": ">=24",
      "pinned": "26.3",
      "license": "Apache-2.0 OR BSD-2-Clause",
      "license_metadata": "Apache-2.0 OR BSD-2-Clause",
      "upstream": "https://github.com/pypa/packaging",
      "used_by": "scripts/check_dependencies.py"
    },
    {
      "name": "warp-lang",
      "requirement": ">=1.5,<2",
      "pinned": "1.18.0",
      "license": "Apache-2.0",
      "license_metadata": "Apache-2.0",
      "upstream": "https://github.com/NVIDIA/warp",
      "used_by": "gpu/warp_mc.py (CPU in CI; the Linux wheel also carries CUDA)"
    },
    {
      "name": "simpy",
      "requirement": ">=4,<5",
      "pinned": null,
      "license": "MIT",
      "license_metadata": null,
      "upstream": "https://gitlab.com/team-simpy/simpy",
      "used_by": "optional; not imported by the package (sim/des.py is our own engine)"
    },
    {
      "name": "torch",
      "requirement": ">=2.4,<3",
      "pinned": null,
      "license": "BSD-3-Clause",
      "license_metadata": null,
      "upstream": "https://github.com/pytorch/pytorch",
      "used_by": "optional GPU env: anomaly.py / scripts/train_anomaly.py"
    },
    {
      "name": "torchvision",
      "requirement": ">=0.19,<1",
      "pinned": null,
      "license": "BSD-3-Clause",
      "license_metadata": null,
      "upstream": "https://github.com/pytorch/vision",
      "used_by": "optional GPU env: anomaly.py (ImageNet teacher weights have their own terms)"
    },
    {
      "name": "onnx",
      "requirement": ">=1.16,<2",
      "pinned": null,
      "license": "Apache-2.0",
      "license_metadata": null,
      "upstream": "https://github.com/onnx/onnx",
      "used_by": "optional GPU env: export inspection"
    },
    {
      "name": "supervision",
      "requirement": ">=0.28,<1",
      "pinned": null,
      "license": "MIT",
      "license_metadata": null,
      "upstream": "https://github.com/roboflow/supervision",
      "used_by": "optional renderer in inspection_visuals.py"
    }
  ],
  "transitive_license_review": [],
  "upstream_components": [
    {
      "id": "cadquery",
      "name": "CadQuery",
      "kind": "repo",
      "url": "https://github.com/CadQuery/cadquery",
      "license": "Apache-2.0",
      "license_review": "reviewed",
      "revision": null,
      "bundled": false,
      "notes": "OCCT dependencies to verify on install"
    },
    {
      "id": "factorysimpy",
      "name": "FactorySimPy",
      "kind": "repo",
      "url": "https://github.com/FactorySimPy/FactorySimPy",
      "license": "MIT",
      "license_review": "reviewed",
      "revision": null,
      "bundled": false,
      "notes": "small project; pin a reviewed commit before use"
    },
    {
      "id": "anomalib",
      "name": "Anomalib",
      "kind": "repo",
      "url": "https://github.com/open-edge-platform/anomalib",
      "license": "Apache-2.0",
      "license_review": "reviewed",
      "revision": null,
      "bundled": false,
      "notes": "separate environment; weights and datasets have their own terms"
    },
    {
      "id": "ortools",
      "name": "Google OR-Tools",
      "kind": "repo",
      "url": "https://github.com/google/or-tools",
      "license": "Apache-2.0 (verify pinned build)",
      "license_review": "to_verify",
      "revision": null,
      "bundled": false,
      "notes": "CPU matching/scheduling baseline"
    },
    {
      "id": "hailo-model-zoo",
      "name": "Hailo Model Zoo",
      "kind": "repo",
      "url": "https://github.com/hailo-ai/hailo_model_zoo",
      "license": "verify source, models and toolchain separately",
      "license_review": "to_verify",
      "revision": null,
      "bundled": false,
      "notes": "Raspberry Pi + Hailo-8L local vision; compatible HEF only"
    },
    {
      "id": "nebius-token-factory",
      "name": "Nebius AI Studio / Token Factory API",
      "kind": "service",
      "url": "https://api.tokenfactory.nebius.com/docs",
      "license": "service terms of use; per-model licences in the Nebius catalogue",
      "license_review": "to_verify",
      "revision": null,
      "bundled": false,
      "notes": "OpenAI-compatible endpoint; credits and an API key required"
    },
    {
      "id": "openai-api",
      "name": "OpenAI API",
      "kind": "service",
      "url": "https://platform.openai.com/docs",
      "license": "service terms of use",
      "license_review": "to_verify",
      "revision": null,
      "bundled": false,
      "notes": "paid API key required"
    },
    {
      "id": "nvidia-tao",
      "name": "NVIDIA TAO Toolkit",
      "kind": "sdk",
      "url": "https://github.com/NVIDIA-TAO",
      "license": "Apache-2.0 source; NGC pretrained weights under separate terms",
      "license_review": "reviewed",
      "revision": null,
      "bundled": false,
      "notes": ""
    },
    {
      "id": "nvidia-cuopt",
      "name": "NVIDIA cuOpt",
      "kind": "repo",
      "url": "https://github.com/NVIDIA/cuopt",
      "license": "Apache-2.0",
      "license_review": "reviewed",
      "revision": null,
      "bundled": false,
      "notes": "supported CUDA GPU required"
    },
    {
      "id": "isaac-sim",